{
  "meta": {
    "title": "Competitor & Market Analysis",
    "subtitle": "Bangladesh A2P SMS and CPaaS",
    "market": "A2P SMS / CPaaS",
    "region": "Bangladesh",
    "run_date": "2026-10-19",
    "prepared_for": "Investors and partners",
    "prepared_by": "Example Co marketing",
    "confidentiality": "Sample — not real data",
    "version": "SAMPLE — placeholder content for layout review",
    "is_sample": true
  },
  "us": {
    "name": "Example Co",
    "licence": "Example licence",
    "channels": {
      "sms": true,
      "otp": true,
      "masking": true,
      "api": true,
      "whatsapp": true,
      "viber": true,
      "telegram": true,
      "messenger": false,
      "crm": false
    },
    "pagespeed_mobile": null,
    "source_ids": [
      "INT"
    ]
  },
  "sources": [
    {
      "id": "INT",
      "url": null,
      "title": "Example Co Bangladesh business profile",
      "publisher": "Example Co (internal)",
      "accessed": "2026-10-19"
    },
    {
      "id": "S1",
      "url": "https://example.com/regulator/statistics",
      "title": "Mobile and internet subscribers, June 2026",
      "publisher": "Example Regulator",
      "accessed": "2026-10-19"
    },
    {
      "id": "S2",
      "url": "https://example.com/news/aggregator-licences",
      "title": "Regulator revokes aggregator certificates",
      "publisher": "Example News",
      "accessed": "2026-10-19"
    },
    {
      "id": "S3",
      "url": "https://example.com/news/sms-tariff",
      "title": "Bulk SMS tariff directive",
      "publisher": "Example Financial Daily",
      "accessed": "2026-10-19"
    },
    {
      "id": "S4",
      "url": "https://competitor-a.example.com/",
      "title": "Competitor A — homepage",
      "publisher": "Competitor A",
      "accessed": "2026-10-19"
    },
    {
      "id": "S5",
      "url": "https://competitor-a.example.com/pricing",
      "title": "Competitor A — pricing",
      "publisher": "Competitor A",
      "accessed": "2026-10-19"
    },
    {
      "id": "S6",
      "url": "https://reviews.example.com/competitor-a",
      "title": "Competitor A reviews",
      "publisher": "Example Review Site",
      "accessed": "2026-10-19"
    },
    {
      "id": "S7",
      "url": "https://competitor-b.example.com/",
      "title": "Competitor B — homepage",
      "publisher": "Competitor B",
      "accessed": "2026-10-19"
    },
    {
      "id": "S8",
      "url": "https://competitor-b.example.com/api",
      "title": "Competitor B — API documentation",
      "publisher": "Competitor B",
      "accessed": "2026-10-19"
    },
    {
      "id": "S9",
      "url": "https://competitor-c.example.com/",
      "title": "Competitor C — Bangladesh page",
      "publisher": "Competitor C",
      "accessed": "2026-10-19"
    },
    {
      "id": "S10",
      "url": "https://example.com/news/partnership",
      "title": "Competitor C announces local partnership",
      "publisher": "Example Tech News",
      "accessed": "2026-10-19"
    },
    {
      "id": "S11",
      "url": "https://pagespeed.web.dev/",
      "title": "PageSpeed Insights results",
      "publisher": "Google",
      "accessed": "2026-10-19"
    },
    {
      "id": "S12",
      "url": "https://example.com/ott-usage",
      "title": "Messaging app usage in Bangladesh",
      "publisher": "Example Research",
      "accessed": "2026-10-19"
    }
  ],
  "executive_summary": {
    "headline": "A regulated, price-capped market where nobody yet sells multichannel to enterprises.",
    "key_numbers": [
      {
        "value": "189.8M",
        "label": "active mobile subscriptions",
        "source_ids": [
          "S1"
        ]
      },
      {
        "value": "~85",
        "label": "licensed A2P aggregators after revocations",
        "source_ids": [
          "S2"
        ]
      },
      {
        "value": "Tk 0.30",
        "label": "regulated floor per SMS",
        "source_ids": [
          "S3"
        ]
      },
      {
        "value": "1 of 10",
        "label": "competitors profiled offer OTT channels",
        "source_ids": [
          "S4",
          "S7",
          "S9"
        ]
      }
    ],
    "findings": [
      {
        "text": "Sample finding. Price is fixed by the regulator, so competitors differentiate on reach, reliability and relationships — not on rate.",
        "source_ids": [
          "S3"
        ]
      },
      {
        "text": "Sample finding. The strongest local player owns the banking segment through a decade-old SMS-banking platform.",
        "source_ids": [
          "S4"
        ]
      },
      {
        "text": "Sample finding. International CPaaS providers reach Bangladesh only through local licensed partners.",
        "source_ids": [
          "S9",
          "S10"
        ]
      },
      {
        "text": "Sample finding. Example Co holds its own licence and three operator agreements — an asset most smaller rivals lack.",
        "source_ids": [
          "INT"
        ]
      }
    ],
    "bottom_line": "Sample bottom line. Example Co's entry case rests on being the only licensed local aggregator with a working multichannel cascade. The first 12 months should prove it with two or three reference enterprise clients."
  },
  "market_overview": {
    "intro": [
      {
        "text": "Sample paragraph. All application-to-person SMS in Bangladesh must pass through regulator-enlisted aggregators, which connect to the four mobile operators.",
        "source_ids": [
          "S2"
        ]
      },
      {
        "text": "Sample paragraph. The regulator sets a tariff band per message, which removes price as a competitive lever.",
        "source_ids": [
          "S3"
        ]
      }
    ],
    "stats": [
      {
        "value": "189.8M",
        "label": "Mobile subscriptions",
        "source_ids": [
          "S1"
        ]
      },
      {
        "value": "135.9M",
        "label": "Internet subscriptions",
        "source_ids": [
          "S1"
        ]
      },
      {
        "value": "4",
        "label": "Mobile operators",
        "source_ids": [
          "S1"
        ]
      }
    ],
    "operators": [
      {
        "name": "Grameenphone",
        "value": 86.5
      },
      {
        "name": "Robi",
        "value": 57.4
      },
      {
        "name": "Banglalink",
        "value": 38.0
      },
      {
        "name": "Teletalk",
        "value": 6.6
      }
    ],
    "operators_unit": "Subscribers, millions",
    "operators_source_ids": [
      "S1"
    ],
    "regulation": [
      {
        "title": "Licensing",
        "text": "Sample. Only enlisted aggregators may carry A2P traffic. Dozens of certificates were revoked in 2025.",
        "source_ids": [
          "S2"
        ]
      },
      {
        "title": "Tariffs",
        "text": "Sample. A regulated band of Tk 0.30–0.34 per SMS applies to aggregator-to-client pricing.",
        "source_ids": [
          "S3"
        ]
      },
      {
        "title": "Sender IDs",
        "text": "Sample. Masked (branded) sender IDs up to 11 characters need authorisation documents.",
        "source_ids": [
          "S3"
        ]
      },
      {
        "title": "Language & timing",
        "text": "Sample. Promotional SMS must be in Bangla and sent between 6:00 and 23:59.",
        "source_ids": [
          "S3"
        ]
      }
    ],
    "ott": [
      {
        "text": "Sample. Facebook Messenger and imo lead active messaging; WhatsApp ranks lower on active business use than its download numbers suggest.",
        "source_ids": [
          "S12"
        ]
      }
    ]
  },
  "competitors": [
    {
      "id": "competitor-a",
      "name": "Competitor A",
      "type": "direct",
      "tier": "Local — market leader",
      "website": "competitor-a.example.com",
      "one_liner": "Sample. The incumbent for bank SMS, with deep operator links and a payments arm.",
      "threat": "high",
      "positioning": {
        "quote": "Sample tagline in the competitor's own words.",
        "quote_source_ids": [
          "S4"
        ],
        "claims": [
          {
            "text": "Sample. Positions itself as the trusted infrastructure partner for financial institutions.",
            "source_ids": [
              "S4"
            ]
          }
        ]
      },
      "segments": [
        {
          "text": "Sample. Banks, MFS providers and government services.",
          "source_ids": [
            "S4"
          ]
        }
      ],
      "named_clients": [
        {
          "text": "Sample. Lists more than 40 bank logos on its homepage.",
          "source_ids": [
            "S4"
          ]
        }
      ],
      "channels": {
        "sms": true,
        "otp": true,
        "masking": true,
        "api": true,
        "whatsapp": false,
        "viber": false,
        "telegram": false,
        "messenger": false,
        "crm": false
      },
      "features": [
        {
          "text": "Sample. SMS banking platform with push and pull services.",
          "source_ids": [
            "S4"
          ]
        },
        {
          "text": "Sample. Dedicated OTP route with delivery reports.",
          "source_ids": [
            "S4"
          ]
        }
      ],
      "pricing": {
        "model": "Enterprise quote",
        "claims": [
          {
            "text": "Sample. No public price list; enterprise contracts only.",
            "source_ids": [
              "S5"
            ]
          }
        ]
      },
      "licence": {
        "status": "Own enlistment",
        "claims": [
          {
            "text": "Sample. Appears on the regulator's enlisted aggregator list.",
            "source_ids": [
              "S2"
            ]
          }
        ]
      },
      "web_seo": {
        "pagespeed_mobile": 42,
        "pagespeed_desktop": 71,
        "claims": [
          {
            "text": "Sample. Strong brand search presence; slow mobile homepage.",